{
  "extensions": {
    "azure": {
      "native_next_hop_type": "VirtualAppliance",
      "native_source": "User",
      "native_state": "Active"
    }
  },
  "urn": "urn:mcnet:v1:azure:subscription_id=a1b2c3d4-5e6f-4a7b-8c9d-0e1f2a3b4c5d,location=eastus,resource_group=rg-networking:route:/subscriptions/a1b2c3d4-5e6f-4a7b-8c9d-0e1f2a3b4c5d/resourceGroups/rg-networking/providers/Microsoft.Network/routeTables/rt-app-subnet/routes/to-onprem-via-fw",
  "native_id": "/subscriptions/a1b2c3d4-5e6f-4a7b-8c9d-0e1f2a3b4c5d/resourceGroups/rg-networking/providers/Microsoft.Network/routeTables/rt-app-subnet/routes/to-onprem-via-fw",
  "resource_type": "route",
  "provider": "azure",
  "scope": {
    "provider": "azure",
    "tenant_id": null,
    "account_id": null,
    "subscription_id": "a1b2c3d4-5e6f-4a7b-8c9d-0e1f2a3b4c5d",
    "project_id": null,
    "resource_group": "rg-networking",
    "region": null,
    "location": "eastus",
    "zone": null,
    "collected_at": "2026-08-28T12:00:00Z"
  },
  "name": "to-onprem-via-fw",
  "tags": {},
  "observed_at": "2026-08-28T12:00:00Z",
  "source_api": "RouteTablesOperations.get",
  "collection_completeness": "complete",
  "destination_cidr": "192.168.0.0/16",
  "destination_ipv6_cidr": null,
  "next_hop_type": "instance",
  "next_hop_target": "10.20.1.250",
  "origin": "static",
  "state": "active",
  "priority": null
}
